CODIGO ACAO;NOME ACAO;2010;2011;2012;2013;2014;2015
10900000;ADEQUACAO DAS INSTALACOES POLICIAIS MILITARES;0;0;0;0;0;8646537,270000001
19410000;INFRAESTRUTURA DE PREDIOS JUDICIAIS;0,0;0;0,0;0,0;26679591,169999998;51519995,10000001
56410000;PERICIAS NA AREA DE MEDICINA LEGAL;343618,58;151904,12;414026,11;280478,65;301954,2;64936,31
59570000;FORMACAO CAPACITACAO SERVIDORES E PARCEIROS;4426488,649999999;9186288,75;1660398,2299999997;0;0;0
48590000;COORDENACAO E ADMINISTRACAO GERAL;49720532,62000006;49308262,300000004;80580777,68000004;67618733,83999991;125863528,14000018;76064155,7300001
41520000;ATEND.MED. POR TERCEIROS/ORGANIZACOES SOCIAIS;0,0;0;0;0;0;0
18250000;REVITALIZACAO DA REDE EXECUTORA;0;0;0;0;0;11557069,87
12180000;IMPLANTACAO CENTROS INTEGRACAO CIDADANIA-CIC;618280,7300000001;1025596,24;155434,41;0,0;97996,93;0
21450000;SANEBASE-DESENVOLVIMENTO DE SANEAMENTO BASICO;2423639,16;1997659,47;652865,92;1252323,69;4139644,370000001;0
61600000;ASSISTENCIA MEDICA, HOSP. E AMB. HOSP.UNICAMP;0;0;0;0;0,0;33915920,48
14300000;CONSTRUCAO,REFORMA FORUNS/ MINISTERIO PUBLICO;19187870,98;38253874,440000005;31184341,750000015;33498561,08000001;63533101,030000016;0
24710000;PRATICAS MANEJO SOLO MITIGACAO EMIS. CARBONO;0;0;0;0;0,0;208965,15
44550000;APOIO ADMINISTRATIVO;0;0;0;0;0;41947949,54000001
13770000;CONSTRUCAO REF. AMPL. AREAS FISICAS SEC.SAUDE;13626673,749999998;3163244,1799999992;36066080,24999999;85679592,25;85374766,38000001;0
48260000;DISTRIBUICAO DA JUSTICA;416463108,53999984;438340440,44000036;436877222,3600001;601319723,54;739516652,56;817669101,6699988
60120000;PAG.PRECATORIOS REG.ESPECIAL-TRANSPORTE;0;0;0;0;0;0,0
60120000;PAG.PRECATORIOS REG.ESP.EM.CONST.-TRANSPORTE;0;0,0;0,0;0,0;0,0;0
41680000;ADMINISTRACAO GERAL DO CORPO DE BOMBEIROS;1037490,1499999998;1035553,4799999996;2764288,300000001;4069461,029999999;7854524,049999998;5756215,07
60670000;ESTRUTURACAO E MODERNIZACAO DA FISCALIZACAO;0;0;0;0;0;12910,0
51010000;MANUTENCAO DA PROCURADORIA GERAL DO ESTADO;7363464,359999999;0,0;726074,61;0;0;0
44570000;VIGILANCIA SANITARIA VEGETAL E MEIO AMBIENTE;0;0;0;0;0;3763002,9900000007
22830000;EXECUCAO DAS OBRAS DO RODOANEL - TRECHO NORTE;0;0;0,0;18122000,0;234912199,01;140219004,81
44530000;ASSESSORIA CRIACAO E CONSOLID. ASSOC. E COOP.;0;0;0;0;0;113372,9
15720000;RENOVACAO E RECUPERACAO DO PARQUE DE MAQUINAS;0,0;0;0;0;0;0
60850000;PREVENCAO PROM. SAUDE OCUPACIONAL DO SERVIDOR;0;0;0,0;193450,0;193450,0;0
24940000;CONSTRUCAO E AMPLIACAO DA REDE FISICA ESCOLAR;0;0;0;0;0,0;28166855,52999995
51610000;DESENV. ENS. FUND. PROF. MAGISTERIO-FUNDEB;0;0;0;0;0;0,0
56360000;GESTAO DO ACESSA SP;0;0;0;0;0;4102805,7
59320000;GESTAO DE RECURSOS DE TI E COMUNICACAO;0;0;0;0;0;35069407,679999985
15970000;AGUA LIMPA;3054964,63;703259,33;11480300,729999999;16623661,55;29707866,959999993;66509718,24000001
57610000;SUPORTE GESTAO DA ESTRATEGIA DA SEC.FAZENDA;1771,94;9700,48;0,0;4039223,8100000005;5331282,91;2527792,3499999996
58250000;ATIVIDADES PREV.SIT.DE RISCO PESSOAL E SOCIAL;161386,14;1151886,14;1151886,14;0;0;0
51630000;MANUTENCAO DA REDE DE ENSINO MEDIO;73725373,36;101080049,75999995;128827883,94999994;57952089,64000001;36278261,0;342494,12
20250000;ADAPTACOES DAS INSTALACOES  SEC. DA CULTURA;0,0;366212,74;28769,27;52145,31;0;0
61540000;RENDA CIDADA - BENEFICIO IDOSO;0;0;0;0;0;9061,08
60840000;GESTAO ADMINISTRATIVA;0;0;0,0;4038818,2;6670407,380000001;4720784,760000002
54880000;FISCALIZACAO DO MERCADO DE CONSUMO;868,58;12976,92;0,0;46573,28;33516,5;0
55500000;MANUTENCAO E EXPANSAO DA REDE INTRAGOV;181009,52999999997;127919,76000000001;224375,99999999997;580448,7599999999;857999,6399999997;380868,57999999996
48600000;ATENDIMENTO MEDICO, AMB. HOSPITALAR PROPRIO;35684261,28999999;41441984,05;39658119,68;49407583,06999998;57456638,39000005;0
24860000;PARTICIPACAO DO ESTADO NO PROGR MCMV;0;0;0;0;0;0,0
54600000;PRODUCAO TRANSMISSAO-RADIOS,TVS,NOVAS MIDIAS;9569948,149999999;12852806,67;9174227,48;7025575,330000002;7531196,800000002;2554117,9199999995
20760000;UNIVERSIDADE VIRTUAL DO EST.S.PAULO-UNIVESP;6766873,78;3270551,0;7175635,0;9533719,0;0;0
13070000;JOVEM CIDADAO - MEU PRIMEIRO TRABALHO;792436,26;789822,51;517044,74;681209,89;24843,809999999998;0
61230000;MONITORAMENTO E AVALIACAO EM SAUDE;0;0;0;0;0,0;6252,0
59790000;SISTEMA EST.BIBLIOTECAS PUBLICAS;2316794,14;549703,46;3051694,82;483619,12;0,0;0
59440000;SUPORTE AS ACOES DA CORREGEDORIA GERAL DA ADM;0,0;0,0;0,0;0,0;3863,5;10793,15
18980000;ADEQUACAO DO SISTEMA PRISIONAL;19232112,26;24083746,489999987;20077599,04;7152100,33;0;0
55020000;INCREMENTO DO TURISMO MUNICIPAL;0;0;0;0;0;463326,86999999994
22110000;IMPLANTAÇÃO CENTRO DE REF.EM REFORMA AGRÁRIA;45773,0;0;0;0;0;0
60090000;PROMOCAO DO TURISMO E EVENTOS;0,0;590217,1;892550,17;1071825,43;1675517,5200000003;566947,05
40080000;GARANTIA  DIR. DA CRIANCA E DO ADOLESCENTE;874713,0;1157354,6;0,0;616564,02;30510,77;0
58640000;CAPACIT.CONSELHEIROS DIREITOS FUNC. CONSELHOS;0,0;4235,0;4641,0;0;0;0
47700000;INTEGRACAO MUNIC.SIST. AGRIC.ABASTECIMENTO;1115000,0;0,0;4619000,0;0,0;1040000,0;0
46240000;LINHAS METROVIARIAS-RESSARCIMENTO GRATUIDADES;0,0;0,0;0,0;0,0;2777412,0;0
14790000;LINHAS DA CPTM-ADAPTACAO PARA ACESSIBILIDADE;17957743,26;2005399,3599999999;618624,29;95504,79;0;0
61440000;PROVISAO POSTOS TRABALHO P/ CUSTODIADOS;0;0;0;0,0;2590186,68;0
58360000;APERF.FORMACAO CONT.PROCURADORES E SERVIDORES;369171,26999999996;87783,23;287183,86;182358,18;211255,06;0
60040000;LIBERDADE ASSISTIDA;0;0,0;1776030,0;1713511,05;1800584,7;1891537,15
56370000;APOIO TECNICO AS PPP'S E OUTRAS PARCERIAS;0;0;0;0;0;32157,0
24670000;FIN.ACOES BACIA BAIXADA SANTISTA REC USO AGUA;0;0;0;0,0;0,0;0
23250000;IMPLANTACAO DO EXPRESSO ABC;0;0;0,0;482351,78;427400,36;159637,78
57300000;CATAVENTO;0,0;0,0;0;0;0;0
51000000;MANUTENCAO DE BIBLIOTECA E DOCUMENTACAO;0,0;0;0;0;0;0
54400000;APOIO TECNICO-ADMINISTRATIVO;0,0;0,0;0,0;0;0;0
12930000;OBRAS INSTAL.UNID.POLICIA TECNICO-CIENTIFICA;912893,29;0,0;428905,00000000006;0,0;7160261,720000001;3697563,0800000005
19910000;EQUALIZACAO TAXAS JUROS FINAN. INCENTIVADOS;0;0;0,0;3600000,0;6128509,67;733137,02
55330000;ADMINISTRACAO DO PATRIMONIO IMOBILIARIO;0;0;0;0;0;229079,82
56420000;INTELIGENCIA POLICIAL;86948201,66000007;97934593,97000001;107505659,17999995;111511646,65000002;100607777,36000001;41027688,470000006
57500000;AVALIACAO DO RENDIMENTO ESCOLAR;6937056,399999999;13739925,35;16941307,96;11139795,48;10189800,0;0
58010000;FUNCIONAMENTO DO CONSELHO EST.SAUDE-CES;0;0;0,0;132,76;139,46;0
49040000;RECUPERACAO/PAVIMENTACAO ADM DIRETA;0;0;0;0;0;1929668,7400000002
57450000;ATENDIMENTO A JOVENS E ADULTOS NA EDUCACAO;0,0;0,0;3428582,97;2467196,47;882413,53;0
61460000;SUPORTE ADMINISTRATIVO E FORMACAO DO SERVIDOR;0;0;0;0,0;26672104,430000022;0
54740000;SISTEMAS  ACOMP.ANALISE REG.METROPOLITANAS;0,0;0,0;0;0;0;0
25170000;FINANC.ACOES UGRHI SERRA MANTIQUEIRA-USO AGUA;0;0;0;0;0;0,0
55320000;ATEND.AMB.HOSP.SERV.CONTR./CONV.GEST.ESTADUAL;0,0;6669342,54;33065232,899999995;11455712,280000001;52295591,089999996;63660419,980000004
61700000;REMUN.E ENC.DOS PROF.MAG. ED.BAS.FUNDEB;0;0;0;0;0,0;1053561051,6299995
48690000;PRODUCAO DE VACINAS;63463,0;262391,0;2059392,9499999997;296264,0;291113,17;0,0
50020000;ATENDIMENTO ODONTOLOGICO POLICIAIS MILITARES;162699,45;135132,53999999998;72209,36000000002;0;0;0
20610000;EDUCACAO SANITARIA PARA PRODUTORES RURAIS;93057,84;916987,9500000001;35940,0;0,0;21934,0;0
13610000;PLANO DE INVESTIMENTOS DO TRIBUNAL DE CONTAS;1303502,85;3624680,1;5791634,760000002;2997648,45;4661807,67;5173092,749999999
41380000;EXAMES  LABORATORIO  INTERESSE SAUDE PUBLICA;621765,8;782051,7299999997;345241,67;814138,3099999998;12839247,860000005;6315019,429999998
41020000;INFRAESTRUTURA TURISTICA MUNICIPIOS-ESTANCIAS;0;0;0;0;0;159083943,34999996
56370000;ESTUDOS MODELAGEM  PPP PARA PROJ.PRIORITARIOS;95740,55;226618,21;0,0;927260,0;1763356,03;0
57030000;REGULARIZACAO FUNDIARIA DE CONJ.HABITACIONAIS;2736352,0;0;0;0;0;0
48160000;AMPLIACAO,ATUAL.MAN.EQUIP.SIST.INFORMATIZADOS;0,0;0,0;0;0;0;0
44580000;VIGILANCIA SANITARIA ANIMAL;2847494,8199999994;5682239,269999996;2602839,799999999;3341671,209999999;4082233,3899999983;0
24900000;PRODUCAO DE LOTES URB. EM PARC. C/MUNICIPIOS;0;0;0;0;0,0;1252738,79
42860000;MONIT. DA QUALID. E CUSTOS TRANSPORTE METROP.;0;0;0;0;0;0,0
51320000;CAPACITACAO EM ESPORTE;0,0;0,0;65000,0;0;0,0;0
21920000;DESENV. DE INICIATIVAS DE INCLUSÃO DIGITAL;0,0;0,0;0;0;0;0
61650000;ATEND. DESCENTRALIZADO A SAUDE POP.PRISIONAL;0;0;0;0;0,0;0,0
54690000;OFICINAS CULTURAIS;28927,619999999995;33517,590000000004;680335,47;629649,45;493315,88999999996;37945,69
49630000;PRODUCAO RENDA ASSENT.QUILOMBOS DEMAIS BENEF.;396913,85;219294,98;269977,80000000005;571834,2000000001;285602,39;151675,92
18590000;DESENVOLVIMENTO ECOTURISMO REG.MATA ATLANTICA;2782224,96;2625855,71;434944,36;1847764,2500000002;35304,16;45763,0
59380000;ENSINO TECNICO;12406300,679999996;11697880,1;29235117,68;1667049,22;12205449,54;0
49920000;ADMINISTRACAO GERAL DA POLICIA MILITAR;0;0;0;0;0;19671968,569999956
51240000;LAZER PARA TODOS;0;0;0;0;0;0,0
54640000;SUPORTE IMPLEM.POLITICAS PUBLICAS MUNICIPIOS;2581,3;4435,2;5366,38;0;0;0
55600000;EDUC PUBLICO-INFORMAC.EDUC.P/PUB.VIA INTERNET;99868,09;0;0;0;0;0
50000000;RESGATE;526688,46;5030195,53;2065126,17;2115063,34;1579116,0999999999;0
50990000;ACOES DE COMUNICACAO DA PGE;10728,0;100838,0;94530,0;0;0;0
57320000;GESTAO DE MUSEUS;0,0;213156,0;0,0;192612,0;3270335,0;0,0
57580000;ACOES DE CONCESSAO SUBSIDIOS HABITACIONAIS;0,0;0,0;2000000,0;0,0;351300,0;0
61440000;PROVISAO DE POSTOS DE TRABALHO;0;0;0;0;0;2862479,6100000003
47870000;JUVENTUDE NOVOS CAMINHOS;0,0;0,0;0,0;0;0;0
40430000;PROMOCAO DE ATIVIDADES CULTURAIS;377328,0;413300,00999999995;420730,98;493661,66000000003;483475,77999999997;556709,6
58820000;IMPLEMENTACAO POLITICA GESTAO DO CONHECIMENTO;350000,0;0,0;137300,0;0;0;0
56280000;FORMACAO APERF.SERVIDORES SISTEMA PENAL;11792,150000000001;17587,87;68454,36;2434481,479999998;0;0
12410000;SUBSCRICAO DE ACOES DO METRO PAGAMENTO DIVIDA;0,0;50837,09;0;0;0;0
59790000;SISTEMA EST. DE BIBLIOTECAS PUBLICAS-SISEB;0;0;0;0;0;0,0
24850000;FINAN. ACOES BACIA BAIXO TIETE - USO DA AGUA;0;0;0;0;0,0;0
60970000;INTEG. ENERGETICA BIOMASSA E BIOCOMBUSTIVEIS;0;0;0;0,0;260000,0;0
60430000;PESQUISAS E ESTUDOS SOBRE POLITICAS PUBLICAS;0;0;0,0;974328,6300000001;2151400,2899999996;1504788,9100000001
51540000;ADMINISTRACAO SEC. EDUCACAO E ENT.VINCULADA;54507855,729999974;51686788,74999994;53294861,90999999;59533865,61999999;532454764,7899997;416708,0299999999
42480000;ORIENTACAO AO TRABALHADOR;0;0;0;0;0;770710,07
57570000;DESENV. ENS. MEDIO-PROF. MAGISTERIO-FUNDEB;0;0;0;0;0;0,0
60610000;PREVENCAO E EDUCACAO PUBLICA;0;0;0;0;0;512078,0
49850000;GESTAO DA POLITICA DE SEGURANCA PUBLICA;16880448,889999997;16583228,799999999;20449863,37;24603509,299999993;108204666,36999996;130553132,94000003
23710000;APOIO A GESTAO DAS MICRO E PEQUENAS EMPRESAS;0;0;0;0,0;623073,12;0
60580000;OLHO DIGITAL;0;0;0,0;374262,57;395340,66000000003;206690,89
61380000;CONSER., MANUT. E REPAR EM PREDIOS ESCOLARES;0;0;0;0,0;43346417,89000002;0
56320000;TRANSPORTE DE ALUNOS DO ENSINO MEDIO;0,0;0,0;0;0;0;0
53580000;APOIO TECNICO-ADMINISTRATIVO;2495225,64;968744,6900000001;2070838,5999999999;2687,04;0;0
14180000;DUPLICACAO IMPLANT. RECUP. DE ROD. ESTADUAIS;37020360,50999999;42311513,41;558052952,5500001;788200014,03;463556971,8300003;0
47130000;GESTAO PUBLICA EM DESENVOLVIMENTO RURAL;4464812,689999999;4786352,8999999985;4788784,739999999;5976943,999999997;7722687,059999999;6964345,56
42870000;APOIO ADMINISTRATIVO;0,0;0,0;0;0;0;0
48490000;APOIO FINANCEIRO AOS MUNICIPIOS;0;0;0;0;0;59341200,879999995
54910000;MANUTENCAO AMPL.SIST.ESTRATEGICO INFORMACOES;0,0;0,0;0;0;0;0
61300000;EJA MUNDO DO TRABALHO-EDUC. JOVENS E ADULTOS;0;0;0,0;2198045,35;7235786,25;605469,84
42270000;PROMOCAO DO EMPREGO E TRABALHO;0;0;0;0;0;0,0
56780000;GESTAO DE COLECOES CIENTIFICAS;0;0;0;0;0;11069,61
57340000;MUSEUS HISTORICOS - CAPITAL E INTERIOR;73084,89;137275,45;292217,53;499050,0;0;0
60350000;PROTECAO SOCIAL ESPECIAL DE ALTA COMPLEXIDADE;0;0;0;0;0;8007153,120000006
54210000;ADMINISTRACAO GERAL DO IAMSPE;8130901,989999999;14386484,280000001;9313200,090000002;8160024,869999998;5769658,04;0
48490000;APOIO FINANCEIRO ENT.FILANTROPICAS MUNICIPAIS;14970191,459999999;20919818,069999997;158771622,35000002;122204747,85000001;276133811,68999994;0
57980000;GESTAO E FUNCIONAMENTO DA DEFENSORIA PUBLICA;10830080,340000004;14123967,439999998;21043919,59000001;20988039,48999999;9877970,630000012;9027553,029999992
54920000;PORTAL DE SERVICOS PUBLICOS;0,0;0,0;0;0;0;0
24700000;EXPANSAO INFRAEST. CUSTODIA E REINTEGRACAO;0;0;0;0,0;65488036,97000001;35634437,24
61730000;MODERN.E MANUT.TECN.NAS UNID.ESCOLARES;0;0;0;0;0,0;0
23540000;APERFEICOAMENTO DA GESTAO DO DPME;0;0;0,0;1271465,74;0;0
59250000;GERACAO CONHECIMENTO TECNOLOGIAS AGRONEGOCIO;10390374,350000003;12022673,24;14516343,18;14417425,760000005;18091847,05999999;0
58150000;INFORMACOES ESTRATEGICAS FORM. PROFISSIONAL;0,0;0,0;157242,0;0;0,0;0
41960000;ADMINISTRACAO GERAL;0;0;0;0;0;32198353,440000013
52740000;ASSISTENCIA MEDICA,HOSPITALAR  E AMBULATORIAL;193441124,80000004;262330621,90999845;362509386,54999757;408346837,68999934;108658078,2699999;0
16840000;SUBSCRICAO DE ACOES DA PRODESP;4512315,4;0,0;18922839,0;11077159,96;0;0
57490000;MONITORAMENTO AVAL. PROJ. PROG. EDUCACIONAIS;70355,81;500000,0;0,0;11800,0;47594,0;0
53420000;ASSESSORAMENTO COORD. POL. ADM. GOVERNAMENTAL;1318522,23;3015469,53;1315081,82;0;0;0
50740000;APOIO AOS PLANOS REGION. DESENV. SUSTENTAVEL;12273,1;1100,0;0;0;0;0
46400000;GERENCIAMENTO E DIFUSAO INFORM.AMBIENTAIS;0;0;0;0;0;0,0
12910000;IMPLANTACAO DE MELHORIAS NA MALHA HIDROVIARIA;104257,51;64994,33;1461130,8900000001;20373184,470000003;28631373,980000004;0
60570000;ELABORACAO MONITORAMENTO POLITICAS PUBLICAS;0;0;0,0;531251,49;251714,86;0,0
25180000;FINANC.ACOES UGRHI SAPUCAI-MIRIM/GRANDE-AGUA;0;0;0;0;0;0,0
46140000;MANUTENCAOTECNOLOGIA INFORM. MIN.PUBLICO;2287346,16;2381924,0199999996;2474260,8599999994;3569031,9600000004;3221567,5799999996;0
57990000;MANUT. AMPL. DA .INFORMATIZACAO DEF.PUBLICA;2154027,68;2495625,42;4076408,98;2319002,48;4906597,319999999;0
20920000;LINHA 7- LUZ-JUNDIAI -MODERNIZ.EXP. DA OFERTA;122302852,02999999;34729148,78;46684038,36999999;42860165,69;27548924,849999998;0
56430000;SISTEMA GESTAO DOCUMENTAL E REST.DE DOCUMENTO;0,0;0;0;0;0;0
15730000;IMPLANTACAO RESERVATORIOS RETENCAO-PISCINOES;0;0;0;0;0;19966734,31
60780000;PREVENCAO E COMBATE A INCENDIOS FLORESTAIS;0;0;0,0;27300,0;0,0;0,0
21730000;MODERNIZACAO DA LINHA 12 - SAFIRA DA CPTM;0;0;0;0;0;4648129,99
49870000;PROTECAO A VITIMAS E TESTEMUNHAS;0,0;0,0;83337,0;0,0;0,0;0,0
14190000;RECUPERACAO DE RODOVIAS ESTADUAIS;49335985,25000004;2336872,7299999995;235355266,42999995;12792205,689999998;12786,800000000001;0
43110000;PESQUISA AMBIENTAL CAPACITACAO MEIO AMBIENTE;0;0;0;0;0;2910650,8700000006
61570000;MANUTENCAO E CONSERVACAO DA CALHA DO TIETE;0;0;0;0;0,0;0
48610000;CAPACITACAO APERFEICOAM.PROFISSIONAIS SAUDE;190525,59;161495,32;238480,57;0;0;0
57360000;SISEM - SISTEMA ESTADUAL DE MUSEUS;240827,46;230000,0;0,0;0;0;0
24600000;ARTICULACAO/IMPLEMENTACAO ACOES ESTRATEGICAS;0;0;0,0;318333,61;52767,64;0
58520000;DESENVOLVIMENTO ENS. MEDIO-CENTRO PAULA SOUZA;1656138,9599999997;1608537,6200000003;253569,74;7922208,050000001;19187959,29;17413801,590000004
60110000;PAG.PRECATORIOS REG.ESP.EM.CONST.-EDUCACAO;0;0,0;1524976,38;1734775,87;0,0;0
19500000;IMPLANTACAO DO PARQUE DA JUVENTUDE;0,0;0,0;0;0;0;0
11520000;PREVENINDO E RECONSTRUINDO;7832839,539999999;4756260,639999999;6965360,780000001;4233584,21;12821022,990000002;10308475,579999996
58400000;SERVICOS PESQ.TECNOL.APOIO AO DESENVOLVIMENTO;9774410,540000003;12353765,04;12519550,949999997;20087961,630000003;11547744,269999998;0
54280000;GERENCIAMENTO DO BENEFICIO - SAUDE;5894365,38;5061832,51;7523962,77;11999944,52;12647865,01;0
61140000;EDUCACAO CONTINUADA;0;0;0,0;60400,0;0,0;4020,7
11330000;INSTALACOES DA POLICIA CIVIL;13605676,59;9264594,319999998;7789700,380000001;6003545,2700000005;24976606,930000003;7928838,609999998
52900000;DESENVOLV. EDUCACAO PROFISSIONAL TECNOLOGICA;3560120,1599999983;5365284,72;1289416,93;2306144,87;5634400,779999999;8331124,170000001
49890000;POLICIA JUDICIARIA;0;0;0;0;0;258531211,39999968
51600000;DES. ENS. FUNDAMENTAL-SERVIDORES-FUNDEB;0;0;0;0;0;0,0
55640000;SISTEMAS CORPORATIVOS E INFORMACOES;1703,08;0;0;0;0;0
42560000;ADMINISTRACAO E MANUTENCAO DA SUTACO;6633,990000000001;0,0;0;0;0;0
60300000;ESCOLA DE DESENVOLVIMENTO SOCIAL DE SAO PAULO;0;0;0;0;0;388147,2
61540000;RENDA CIDADA - BENEFICIO AO IDOSO;0;0;0;0;0,0;0
21740000;IMPLANTACAO SIST.NAC. PROT. DEFESA CONSUMIDOR;0,0;65800,0;0,0;0,0;0,0;0,0
51230000;ESPORTE SOCIAL;5149680,0;382787,2;1482440,0;210000,0;2214625,94;0
60720000;FAUNA URBANA;0;0;0,0;87500,0;18228,59;0
57370000;IDENTIFICACAO DO PATRIMONIO CULTURAL PAULISTA;0,0;0,0;253000,0;244338,0;0;0
40760000;MANUTENCAO DO ENSINO MEDIO;0,0;0,0;0,0;0,0;0;0
42510000;ADMINISTRACAO CAIXA BENEFICENTE POL. MILITAR;0;0;0;0;0;2891747,7600000002
41950000;ACESSO A CIDADANIA;4347180,21;4350898,970000001;4920595,170000001;4666204,569999999;9949617,750000004;9813819,879999999
21440000;APOIO ELAB.EXEC.INSTR.PLAN.GESTAO SANEAMENTO;0,0;3227589,16;1562262,44;0,0;6218674,03;0
19570000;CONSTRUCAO APAR.FABRICA MEDIC.-FURP AM.BRAS.;668780,1799999999;0,0;0;0;0;0
60270000;ACAO SOCIAL REGIONAL;0;0;0,0;557060,3200000001;0;0
21120000;REVITALIZACAO COMPETENCIAS TECN. ESTRATEGICAS;0,0;0;0;0;0;0
59350000;ADMINISTRACAO DA EMPLASA;7582178,48;8009165,85;721295,47;163867,47;0;0
59060000;ATENCAO SAUDE ADOLESCENTE MEDIDA CAUTELAR;0;0;0;0;0;25129044,47
22400000;PARTICIPACAO CONT.GESTAO INST.SOCIEDADE CIVIL;0;0,0;74489,84;0,0;178325,12;0,0
48430000;RESIDENCIA MEDICA;367602,49;171355,97999999998;434674,83999999997;0,0;0;0
14180000;DUPLICACAO, IMPLANT., RECUPERACAO DE RODOVIAS;0;0;0;0;0;145649147,54000002
54280000;GERENCIAMENTO DO BENEFICIO SAUDE;0;0;0;0;0;12644623,129999999
53050000;ENSINO POS-GRADUACAO PESQ. UNIV.FAC.ESTADUAIS;354567444,21999985;700846242,0199995;748888857,1999992;833749100,4400009;1055983307,3800002;335024326,6700005
52670000;MANUTENCAO  ATUALIZ INFR-EST CAPAC.INST.PESQ.;1890207,32;0;0;0;0;0
56860000;IMPLANTACAO, MANUTENCAO E ADEQUACAO DA INFRA-;0,0;0,0;0,0;0;0;0
54460000;INTEGRAÇAO CINEMA/TV - PIC-TV;0,0;0,0;0;0;0;0
42850000;LICENCIAMENTO E FISCALIZACAO AMBIENTAIS;0,0;0,0;0;0;0;0
61380000;CONSERVACAO, MANUT.,REPAROS PREDIOS ESCOLARES;0;0;0;0;0;4017891,4900000016
55650000;METRO-RESSARCIMENTO SUBSIDIO AOS ESTUDANTES;0,0;0,0;0,0;0,0;7624374,0;0
49960000;POLICIAMENTO ESCOLAR;2161964,809999998;261699,86000000002;283271,25999999995;0;0;0
17030000;PROJETO AVAL. APRIM. POLITICA SOCIAL EST.S.P;740924,72;0;0;0;0;0
22080000;ADEQUACAO DA INFRAESTRUTURA AO SINASE E ECA;0;0;0;0;0;22759793,79
50440000;INTERMEDIACAO DE MAO DE OBRA;2484865,7;1314971,16;1969784,9100000001;1281954,8199999998;240528,56000000003;1239679,76
57350000;PINACOTECA E MUSEUS DE ARTE;0,0;1400000,0;0,0;2000000,0;369439,0;0
58970000;GERENCIAMENTO DO DATACENTER DO ESTADO;280939,05;254172,82;492610,26999999996;278399,19;114248,46;721918,0499999999
24730000;APOIO A PPP PARA OBRAS DE UNID.HOSPITALARES;0;0;0;0,0;16636637,24;0
18540000;SUBSCRICAO DE ACOES DA CETESB;2250103,9299999997;237136,21;2399992,0;0;0,0;8814978,8
59140000;FORMACAO CAPACITACAO PROFISSIONAIS FUND.ITESP;0,0;0,0;0;0;0;0
52920000;DESENVOLVIMENTO EDUCACAO PROFISSIONAL TECNICA;163378771,8000001;148369023,29999995;175872900,23999992;135237244,17000005;280434576,0400001;246952795,88999996
43250000;APOIO FINANCEIRO PROJ.FUNDOS MUN. ENT.SOCIAIS;0;0;0;0;0;73482,72
44990000;EVENTOS DE CAPACITACAO NAS AREAS FAZENDARIAS;1130058,99;1533360,7400000002;675799,63;1341128,2900000003;1881252,2300000007;969673,7799999999
45150000;SERVICO DA DIVIDA PUBLICA EXTERNA;0,0;0,0;0,0;0,0;0;0
17670000;AMPLIACAO REDE TRANSM. RADIO E TV EDUCATIVAS;0,0;337598,16;448613,57999999996;0;0;0
25100000;INVESTIMENTO RODOVIARIO SAO PAULO-BID FASE II;0;0;0;0;0;0,0
61580000;COMPLEMENTACAO APOSENTAD. E PENSOES - IPEM/SP;0;0;0;0;0,0;135740,81
42750000;ATENDIMENTO A POPULACAO PRISIONAL;0,0;0;0;0;0;0
24220000;FESTIVAL INTERN. DE INVERNO CAMPOS DO JORDAO;0;0;0,0;0,0;0,0;0
61760000;PROM.DE ACOES A QUALID.VIDA DOS PROF.DA EDUC.;0;0;0;0;0,0;0
61430000;FORMACAO EDUCACIONAL E PROFISSIONAL;0;0;0;0;0;429045,49999999936
50630000;GESTAO DE UNIDADES DE CONSERVACAO;6032473,4300000025;4007362,440000001;3899477,470000001;4715219,059999998;6833491,849999999;1984775,4100000004
22930000;MODERNIZACAO ADM. REC. GESTAO FISCAL ESTADOS;0,0;1691567,89;908861,8;1572093,6199999999;0;0
20060000;PRODUCAO DE MORADIAS;23538084,270000003;21729545,429999996;5004207,79;0,0;0,0;0
43110000;PESQUISA AMBIENTAL DIAGNOSTICO REC.NATURAIS;3719930,7700000005;3305224,5100000016;5331313,18;3230983,8599999985;4200781,640000001;0
20170000;MUNICIPIO VERDE AZUL-PROTOCOLO AMBIENTAL;2447,2;0;0;0;0;0
54420000;ATIVIDADES DE DIFUSAO CULTURAL;0,0;0,0;0;0;0;0
52040000;SISTEMA PAULISTA DE AMBIENTES DE INOVACAO;0;0;0;0;0;3745181,9200000004
17680000;MODERNIZACAO  EXPANSAO DO PARQUE TECNOLOGICO;0,0;402511,77;866933,1000000001;233405,0;0,0;5854909,599999999
56920000;CONSERVATORIO DE TATUI;0;0;0;0;0;0,0
43940000;APOIO TECNOLOGICO AOS MUNICIPIOS - PATEM;1167493,53;1424180,27;1533676,94;1621575,3099999998;3237612,64;650382,43
61640000;FUNCIONAMENTO CORREGEDORIA GERAL DA JUSTICA;0;0;0;0;0,0;0,0
61280000;CONTROLE DO EXERCICIO E DO DESEMPENHO FUNCION;0;0;0;0,0;0;0
50040000;REAPARELHAMENTO DA POLICIA  PAULISTA;33835715,73;140193500,95999998;223135577,94999984;192792706,6700001;191464592,84999973;27965721,889999997
15150000;EXPANSAO DA EDUCACAO PROFISSIONAL TECNOLOGICA;12397676,09;24660768,97;72147340,50999999;35273500,95999999;37427482,36000001;18259567,230000008
40330000;MANUTENCAO OPERACAO IMPLANT.ESTR. HIDRAULICAS;9004639,61;3832816,47;3474480,5300000003;1509730,4100000001;97381,26;0
41360000;TURISMO INTEGRADO REGIONAL;10366,21;4788,11;1319908,1199999999;2688993,21;4198795,18;484407,6500000001
61760000;PROMOCAO DE QUALIDADE DE VIDA PROF.EDUCACAO;0;0;0;0;0;4020202,9599999995
54260000;GERENCIAMENTO DO BENEFICIO - EDUCACAO;13461289,85;24785780,439999998;82736710,49000001;43338832,91;64350009,17;0
51560000;ATENDIMENTO ESPECIALIZADO ALUNOS EDUCACAO BAS;2682302,4000000013;3574287,2199999997;6224391,530000005;3077901,399999999;14953325,290000001;0
22760000;FOMENTO AO CREDITO HABITACIONAL;0;0;0;0;0;4911694,71
14110000;SUBSCRICAO DE ACOES DA CODASP;1233000,0;3767000,0;1600000,0;0;0,0;3792200,0
44350000;ABASTECIMENTO DE SEMENTES E MUDAS EST.S.PAULO;2153590,35;2162187,2599999993;1246453,3;333460,4500000001;639381,0900000001;457150,11
59100000;FORMACAO CAPAC.BENEFICIARIOS E TECNICOS ITESP;24040,14;107775,73;62376,659999999996;83318,36;87086,62;76889,6
55790000;RENDA CIDADA - ERRADICACAO DA MISERIA EXTREMA;8277791,2;12467629,8;14761797,13;17351107,049999997;17575291,07;0
11140000;ESTRADAS VICINAIS;21877825,720000006;15349615,24;32753518,840000004;29288988,770000003;18862789,88;3613544,04
23010000;IMPLANTACAO DO PARQUE VARZEAS DO TIETE;0;0;0;0;0;3870383,3100000005
49000000;POLICIAMENTO NAS RODOVIAS SOB JURISDICAO DER;2386053,7600000002;2559151,11;2488942,8900000015;6887010,470000001;123505,98;762148,4000000001
23120000;MEMORIA DO LEGISLATIVO;0;0;0,0;0,0;0,0;0
61320000;INTEGRACAO P/REGISTRO/LEGALIZACAO DE EMPRESAS;0;0;0,0;4086234,61;10365929,130000003;9718181,430000003
22280000;DESENV.INSTRUMENTOS PLANEJ.REG.METROPOLITANAS;0,0;56935,130000000005;0;0;0;0
50000000;SALVAMENTO E RESGATE;0;0;0;0;0;1331697,2
57720000;SISTEMA DE TELEAUDIENCIA CRIMINAL;556032,0;1308323,28;712984,14;742572,6;0;0
57140000;FABRICAS DE CULTURA;0;0;0;0;0;1338270,5599999998
51430000;INCLUSAO JOVENS E ADULTOS ENS.FUNDAMENTAL-EJA;99277,2;0,0;4859673,82;409889,05000000005;317401,13;0
49590000;REGULARIZACAO FUNDIARIA URBANA E RURAL;0;0;0;0;0;12600,829999999998
44830000;AVALIACAO DE POLITICAS PUBLICAS E DESEMPENHO;0;0;0;0;0;842144,97
58470000;APOIO POLITICA DESENV.,CIENCIA,TECN. INOVACAO;0,0;0,0;0,0;28408000,0;0,0;3870000,0
11670000;IMPLEMENTAÇÃO DE MICROBACIAS HIDROGRÁFICAS;431659,2000000001;0,0;0;0;0;0
42250000;BANCO DO POVO PAULISTA;630442,88;217952,55;1073877,43;401380,51;1155978,77;233923,59
15240000;EXPANSÃO DO ENSINO PÚBLICO SUPERIOR;5000000,0;0,0;0,0;0,0;0,0;0
61450000;ASSISTENCIA LEGAL CUSTODIADOS APOIO REINT.SOC;0;0;0;0;0;0,0
58810000;MELHORIA QUALID. SUSTENTAB. CONTRAT. PUBLICAS;0;0;0;0;0;12540,0
50550000;REGULARIZACAO DE NUCLEOS HABITACIONAIS;0,0;0,0;0;0;0;0
55760000;PUBLICIDADE DE UTILIDADE PUBLICA;26745429,070000004;11020531,6;13643947,880000003;15014463,57;8593149,569999998;6852914,25
57200000;SAO PAULO AMIGO DA AMAZONIA;143270,51;214226,29;13247,810000000001;0;0;0
61470000;PROMOCAO APLICACAO PENAS E MED. ALTERNATIVAS;0;0;0;0;0;410333,1900000001
59070000;EXECUCAO CUMPRIMENTO MEDIDAS SOCIOEDUCATIVAS;31055685,130000003;33274244,770000033;28189898,829999987;29584147,420000013;47189988,87999997;0
49350000;ADMINISTRACAO DO COMPLEXO BARRA FUNDA;197536,16999999998;273854,27;192215,3;0;0;0
57670000;CAPACITACAO AGENTES DO AGRONEGOCIO PAULISTA;0,0;0,0;0,0;0,0;7428,4;0,0
55130000;ADMINISTRACAO DA FUNDACAO SEADE;3404118,39;2440325,5200000014;2231703,27;2603915,8099999996;3476219,5899999994;2908349,250000001
54650000;ELABORACAO E ACOMPANHAMENTO ORCAMENTOS ESTADO;0,0;0,0;0,0;0,0;0,0;0
58880000;MONITORAM AVAL.ECONOMIA PAUL.POLITICAS DESEN.;41391,19;81782,59999999999;45384,98;0;0;0
59620000;ACOES INCLUSAO SOCIAL PESSOA COM DEFICIENCIA;2602348,659999999;6979145,750000002;5408228,819999998;6130666,369999998;6319647,06;0
23600000;PROJETO PILOTO DE EFICIENCIA ENERGETICA;0;0;0,0;0,0;0;0
60020000;COMPLEMENTACAO APOS.  PENSOES L.200/74-IAMSPE;0;0,0;9180,5;154804,75;373464,77;402664,33999999997
42880000;PLANEJ. GESTAO DE ACOES DE TRANSPORTE METROP.;0;0;0;0;0;4877540,79
13340000;SUBVENCAO DO PREMIO DO SEGURO RURAL;0;0;0;0;0;6327019,91
42980000;ENSINO FUND.,MEDIO E PROFISS. ATIV. CULTURAIS;548689,2800000001;900741,8;559482,5799999997;716767,4099999988;0;0
