20300000;INFORMATIZAÇÃO DA EDUCAÇÃO BÁSICA;52458923,64000001;558149,8999999999;9807,28;0;0;0
54880000;ATOS FISCALIZATORIOS;0;0;0;0;0;19060,890000000003
51480000;APERFEICOAMENTO PROF.EDUCAD.ENS.FUNDAMENTAL;3476157,349999999;6970493,409999996;4482745,300000001;2540327,600000001;1752252,4700000002;50,96
49970000;PREVENCAO AS DROGAS E A VIOLENCIA/ PROERD;267436,0;260989,0;343986,5;0;0;0
47710000;ACOES INDENIZATORIAS-ADM.INDIRETA;0,0;0,0;66511,0;0;0;0
53120000;RESTAURANTES UNIVERSITARIOS;478137,97000000003;625413,42;689049,37;964740,32;917619,48;1627330,5699999998
41270000;ACOES DE VIGILANCIA SANITARIA E AMBIENTAL;124834,8;47564,41;456102,5;326740,69;326090,56000000006;0
60970000;DESENVOLVIMENTO BIOGAS A PARTIR DA BIOMASSA;0;0;0;0;0;250000,0
53480000;COLMEIA DO SABER - ENSINANDO DEFESA CIVIL;0,0;174920,0;0,0;137800,0;73234,0;0
49040000;PATRULHA RODOVIARIA;642158,36;8141297,379999999;7567413,0;3372380,5400000005;699502,85;0
23040000;FOMENTO REDE CULTURA VIVA - PONTOS DE CULTURA;0;0;0;0;0;0,0
57460000;PROVISAO MATERIAIS APOIO PEDAGOGICO-ENS.MEDIO;82025647,86000004;57737079,24999998;27453624,979999993;15259231,4;27857250,960000005;620700,83
49910000;EDUCACAO E FISCALIZACAO PARA O TRANSITO;0;0;0;0;0;12559515,770000001
52850000;APOIO TECNOL.MICRO,PEQUENAS E MEDIAS EMPRESAS;0,0;333354,0;0,0;518610,0;1031600,0;0,0
22970000;MODERNIZACAO MAT.RODANTE SISTEMA FERROVIARIO;0;0;0;0;0;3277462,91
22940000;IMPLANTACAO SIST. PAULISTA DEFESA AGRICULTURA;0;0,0;0;0;0;0
59240000;PESQUISA DESENV.CAPAC - COMITE TECNOL. DER/SP;0,0;0,0;0;0;0;0
51560000;ATEND.ESPECIALIZADO ALUNOS E PUBL.ESPECIFICOS;0;0;0;0;0;11242699,880000006
61780000;GESTAO E MODERNIZACAO DA SEC. DA EDUCACAO;0;0;0;0;0;571974886,4499999
56770000;GESTAO DE PARQUES URBANOS;6045541,739999999;4992966,330000001;4675386,670000001;3768525,8699999982;8512827,119999997;911810,2899999999
61210000;CAPACITACOES TECNICAS E ADMINISTRATIVAS;0;0;0,0;829648,1299999999;1356087,33;1467098,78
48920000;TRANSFERENCIA DO CONHECIMENTO;0,0;0,0;0;0;0;0
22080000;ADEQUACAO DA INFRAESTRUTURA AO SINASE;25176190,71;13473976,259999998;8426694,41;21754285,159999993;28280638,689999998;0
61660000;PROMOCAO REINT. SOCIAL CUSTODIADOS FAMILIARES;0;0;0;0;0;149419,38
24920000;PARCERIA PUBLICO PRIVADA - PPP HABITACIONAL;0;0;0;0;0;0,0
21910000;AMPLIACAO E MODERNIZACAO DE RECURSOS DE TIC;2908763,3399999994;1911724,29;4814116,609999999;116967,3;45846,0;28958,18
58780000;APRIMORAMENTO MECANISMOS INCENTIVO;0;0;0,0;0,0;5200,0;2997,0
25030000;APOIO HABITACIONAL;0;0;0;0;0;0,0
49950000;ESCOLHA CERTA;3014731,76;5511123,95;6771100,89;10669402,41;10443221,100000005;0
60130000;PAG. PRECATORIOS REG. ESP. EM. CONST.- SAUDE;0;0,0;1014046,19;3465333,67;2000,0;0
59010000;CAPACITACAO, APERF. E DESENV. PROFISSIONAL;0,0;2363,0;0,0;0,0;0,0;0
57010000;GERENCIAMENTO DE RECURSOS DE TIC;4005627,8400000003;7501802,74;849934,9900000002;757508,2499999999;685804,24;773309,9299999999
40730000;SUPRIMENTO GENEROS ALIM.UTENSILIOS E SERVICOS;3131721,76;13083618,139999999;26529196,530000005;12461846,849999998;55012216,79;165188,72
53600000;ADMINISTRACAO ESTAGIOS ADMINISTRACAO PUBLICA;5261586,0600000005;7084948,840000001;7703088,640000001;8855486,940000003;10295044,35;0
60710000;PROT.RECUPERACAO MANANCIAIS DE ABASTECIMENTO;0;0;0,0;0;0;0
51600000;REMUNERACAO E ENCARGOS SERVIDORES - ENS.FUND.;96305119,79000002;106318045,72000003;165151191,25000018;115519933,04000002;127682889,93000008;0
23310000;TREM DE GUARULHOS-IMPLANTACAO;0;0;0,0;5463332,23;5401380,61;0
49390000;ADMINISTRACAO DA FUND. INSTITUTO TERRAS-ITESP;0;0;0;0;0;2151343,0499999993
58800000;PREMIO MARIO COVAS;0;0;0;0;0;15000,0
19270000;SUBSCRICAO DE ACOES CIA.PAULISTA DE PARCERIAS;42561981,08;0,0;0;0;0;0
53990000;DESENV.TECNOL.CAPAC.USO RACIONAL REC.HIDRICOS;0;0;0,0;8000,0;98101,0;0
60420000;GESTAO DE PESSOAS POR TALENTOS;0;0;0;0,0;550950,0;0
13270000;SUBVENCAO AOS PRODUTORES RURAIS-FEAP/BANAGRO;0;0;0;0;0;6292387,890000001
60350000;PROTECAO SOCIAL ESPECIAL - REINS. E INCL.SOC.;0;0;0,0;7344279,189999994;7120131,870000003;0
48360000;PAGAMENTO DE PRECATORIOS;12851028,199999997;112491013,29000008;126352082,35999997;65860106,89;11443934,260000002;496824,32
53500000;DEFESA CIVIL REVITALIZ.MEIO AMBIENTE-S.DO MAR;0,0;0;0;0;0;0
60100000;PAGAMENTO PRECATORIOS REGIME ESPECIAL;0;0;0;0;0;93139508,98
50710000;LICENCAS EMPREEND. BAIXO E ALTO IMP.AMBIENTAL;0;0;0;0;0;7722078,45
49010000;IMPLANTACAO E OPERACAO DE POSTOS DE PESAGEM;0;0;0;0;0;3700845,9200000004
60680000;POLICIAL VALORIZADO. SOCIEDADE PRESTIGIADA;0;0;0,0;79860,6;8795370,590000002;529388,74
23180000;MODERNIZACAO MAT. RODANTE SISTEMA METROVIARIO;0;0;0;0;0;60042589,71
43650000;DESENVOLVIMENTO SUSTENTAVEL;186376,21;144062,94999999998;123545,37000000001;0;0;0
44530000;ASSESSORIA CRIACAO ASSOCIACOES E COOPERATIVAS;95603,65000000001;102344,79;133633,53999999998;99637,55;117147,21999999999;0
51510000;TECNOLOGIAS INOVADORAS FORMACAO PROF.EDUCACAO;3918869,57;6102419,0;10920965,14;10942982,0;13114800,649999999;0
20090000;TRANSFERENCIA DAS INSTALACOES DO DETRAN;978382,85;0,0;0;0;0;0
59830000;GESTAO ESTRATEGICA DE GOVERNO;0;0;0;0;0,0;0
58920000;GERENCIAMENTO DE RECURSOS DE TIC;16740113,26;13694523,249999996;13174599,439999994;19832742,180000003;10459746,62;0
48450000;TECNOLOGIA DA INFORMACAO E COMUNICACAO-TIC;2813813,65;3215993,7399999998;2112354,8499999996;74546,5;0,0;0
20850000;IMPLANTACAO PROJ. QUALIDADE TOTAL ATENDIMENTO;628275,68;37699,71;6405,32;0,0;0;0
22290000;INVESTIMENTOS GESTAO CONTROLE QUAL. AMBIENTAL;10674768,080000002;2683254,57;6056283,03;0;0;0
43230000;MANUTENCAO ATUALIZ. CENTRO REF.EDUC.AMBIENTAL;156368,32;31295,5;260968,0;129430,0;115486,31;0
59480000;APOIO TECNICO-ADMINISTRATIVO;2127693,54;3402454,6300000004;6079085,320000001;8064729,259999997;7585020,569999999;4109950,7600000007
22060000;DESENVOLVIMENTO INICIATIVAS INCLUSAO DIGITAL;0,0;138000,0;0;0;0;0
61690000;IMPL.DE CUR.ADEQ. A CADA ET.DO ENS.;0;0;0;0;0,0;0
25020000;ASSISTENCIA TECNICA HABITACAO INTERESSE SOCIA;0;0;0;0;0,0;0
61270000;AUDITORIA ELETRONICA;0;0;0;0,0;0;0
56960000;CONTRIBUICAO ESTADO A EDUC. BASICA - FUNDEB;0,0;0,0;0,0;0,0;0,0;0
56240000;MANUTENCAO  ATUAL. INFRAESTRUTURA TECNOLOGICA;57515,88;8644,0;14906,07;5861,63;1994,7;91453,13999999998
49140000;MANUT. E SEGURANCA DA REDE DE AEROPORTOS;0;0;0;0;0;6028510,97
41510000;INTEGRACAO DE SERVICOS NA AREA DA CIDADANIA;466904,0800000001;817879,98;532711,18;679747,4999999999;524216,71;0
59870000;MUSEU DO FUTEBOL;0,0;0,0;0;0;0;0
42270000;OBSERVATORIO DO EMPREGO E DO TRABALHO;1432524,0899999999;1427236,9300000002;1246594,0;1177663,96;727640,0;0
25220000;INCORPORACAO TECN.PROD.MEDIC.ESTR.ALTO CUSTO;0;0;0;0;0;0,0
48630000;RESIDENCIA MEDICA;0,0;0,0;8170818,1;4583259,4;960494,01;0,0
16790000;SUBSCRICAO DE ACOES DA DERSA;865000001,4300001;376769718,33;307693942,17999995;320210616,49;0,0;3413764,0
24650000;FINANC.ACOES BACIA ALTO TIETE C/REC USO AGUA;0;0;0;0,0;0,0;0
57390000;VALORIZACAO DO PATRIMONIO CULTURAL PAULISTA;21900,0;0,0;194144,0;544287,0;73505,0;59160,0
57400000;TRANSPORTE DE ALUNOS DA EDUCACAO BASICA;109045722,30000001;434883,5;451816,8;52195636,139999986;283311359,39000005;99874001,89999995
56690000;FISCALIZACAO E CONTROLE METROLOGICO;5991246,510000003;6736903,849999999;9524942,959999992;13027724,799999991;29845806,770000003;13536477,200000001
20910000;ESTUDOS EXP.NOVOS SERV.TRILHOS RM'S AGL.URB.;2532502,83;319427,63;849290,48;1182380,11;2253253,3400000003;0
59580000;COMPANHIA DE DANCA DO ESTADO DE SAO PAULO;0,0;0,0;0,0;0,0;0,0;0,0
55790000;RENDA CIDADA;0;0;0;0;0;1857048,8599999999
53260000;ATENCAO INTEGRAL A SAUDE POPULACAO PRISIONAL;1389350,6799999995;1522053,8700000006;596255,7199999999;1418119,6400000004;0,0;0
55780000;SISTEMA INF.GEOGRAFICAS PLANEJ.METROP-SIGPLAM;77784,54;430500,76;0;0;0;0
24810000;EQUIP.SOC. - CENT.DIA IDOSO E CENT.CONV.IDOSO;0;0;0;0;0,0;0
49130000;REGULACAO FISCALIZACAO CONCESSOES RODOVIARIAS;20220734,940000005;12295405,939999996;14464709,880000003;17032265,109999996;17719712,0;12360741,2
41270000;ACOES DE VIGILANCIA SANITARIA;0;0;0;0;0;1340623,8699999999
53600000;ADMINISTRACAO DOS ESTAGIOS NA ADMINISTRACAO;0;0;0;0;0;12138736,58
57810000;CAMPANHA DE VACINACAO ANIMAL;673259,6700000002;26779,9;106562,56;126437,44;0,0;4300,0
42590000;SUPORTE TECNICO-ADMIN.  AO ARTESAO;235595,27000000008;26066,71;349823,38;210963,22999999992;174629,59000000003;0
42300000;QUALIFICACAO REQUAL.PROFISSIONAL TRABALHADOR;54526902,49;41631909,93;20387775,160000004;2208597,52;7136831,530000001;6096252,889999999
12220000;MINISTERIO PUBLICO-AQUIS.OBRAS E INSTALACOES;11603219,310000002;1281422,2699999998;12113686,170000002;4124942,3800000004;3848223,36;365113,18
58690000;ATIVACAO JOVEM;0;0;0;0;0;0,0
47810000;COMPLEMENTACAO APOSENTADORIAS E PENSOES - IPT;1117715,4300000002;770831,75;1477057,43;935931,2000000001;1009983,09;1084746,62
48580000;TECNOLOGIA DA INFORMACAO E COMUNICACAO;1902712,04;2279697,1999999997;3063974,6100000003;9595932,080000004;8405523,38;9390305,219999997
24970000;NOVA TAMOIOS - CONTORNOS;0;0;0;0;0,0;165900009,0
58060000;INTEGRACAO CURRICULAR NO ENSINO MEDIO;34924655,39;46720991,86999998;40812632,88;47889906,35999999;47837642,22;99975,97000000002
59050000;ATENCAO EDUCACAO ADOLESCENTE MEDIDA CAUTELAR;0;0;0;0;0;14879596,809999997
61900000;RECOMECO: PROGR.EST.ENFRENT.CRACK-DES.SOC;0;0;0;0;0;0,0
56650000;ATENDIMENTO HEMOTERAPICO;529823,44;997831,22;1473620,67;0;0;0
51390000;JOGOS COM IDENTIDADE CULTURAL;1348,2;2869,97;13046,0;0;0;0
47840000;ASSIST.MEDICA, HOSP. PENSIONISTA POL.MILITAR;0;0;0;0;0;17103369,93
20800000;SANEAMENTO RURAL E PEQ. LOCALIDADES ISOLADAS;0;0,0;3706000,0;186790,47;4185241,0599999996;4578174,34
53760000;ESTUDOS DE MACRODRENAGEM;0;0,0;356724,62;0;0;0
19640000;OBRAS ADEQUACAO AMPL. APARELHAMENTO HCFM-USP;19457811,709999997;8464483,08;16222821,729999999;2473441,19;0,0;0
46150000;APERFEICOAMENTO ATIVIDADES DO MINIST.PUBLICO;2187597,28;2769508,1599999997;15720531,08;5332871,33;5163365,159999999;3333755,74
24450000;APOIO TECNICO FIN.AT.PRIMARIA SAUDE COMP.MUN.;0;0;0,0;9076683,0;0,0;0
61590000;ASSISTENCIA MEDICA, HOSP. E AMB. HOSP. DA USP;0;0;0;0;0,0;6167641,35
55990000;AUDITORIAS NAS UNID.ADM.DIRETA E INDIRETA;0;0;0;0;0;2096317,9100000001
56360000;GERENCIAMENTO DO ACESSA SAO PAULO;1335404,0;4073995,0;3450253,96;5161873,96;2267856,0;0
54660000;CAPACITACAO INSTITUCIONAL DOS MUNICIPIOS;5549,13;2014,12;1823,79;0;0;0
58980000;PREVENCAO ENFRENTAMENTO TRAFICO SERES HUMANOS;5400,0;0,0;0;0;0;0
57940000;REG. E FISC. SERV. PUBLICOS SANEAMENTO BASICO;0;0;0;0;0;804384,34
51610000;REMUNERACAO ENC.PROF.MAG.-ENS.FUNDAMENTAL;879157945,3799998;1012489621,7000005;1372772090,6000018;1170274622,1799994;1099926670,9999995;0
44830000;MONITORAMENTO AVALIACAO PROGRAMAS E ACOES PPA;390311,24000000005;1313688,09;842128,62;1713379,5799999998;3653663,9800000004;0
11950000;MELHOR CAMINHO;26231458,41;39873602,69;65678801,87000001;47614323,84000001;54851003,61000001;18670833,15
45510000;COMPLEMENTACAO APOSENTADORIAS PENSOES-SABESP;15168129,54;5531737,23;26656959,259999998;114210370,42;124245364,25;22683982,31
49020000;OPER. PRACAS PEDAGIO RODOVIAS SOB JURISD. DER;136680,87;186573,53;162245,35;274338,38;139780,58000000002;0
61460000;SUPORTE ADMINISTRATIVO EM APOIO CUST.REINTEG.;0;0;0;0;0;24063992,83000005
45350000;PAGAMENTO COMPLEM.APOSENTADORIAS PENSÕES-BNC;12105866,78;0;0;0;0;0
61860000;ATENDIMENTO SOCIAL COMUNIDADES TERAPEUTICAS;0;0;0;0;0;0,0
23180000;MODERNIZ. MATERIAL RODANTE METROVIARIO-BIRD;0;0;0,0;29800000,0;18403864,75;0
56990000;ADMINISTRACAO DA FAPESP;1371276,61;1102863,06;1869292,6100000003;2066794,99;4586725,350000001;8455470,379999999
24670000;FIN.ACOES UGRHI BAIXADA SANTISTA REC USO AGUA;0;0;0;0;0;0,0
42590000;APOIO E ASSISTENCIA AO ARTESAO;0;0;0;0;0;257654,34000000003
10560000;CONSTRUÇAO REF. AMPL.APARELHAM.AREA DE SAUDE;0,0;0,0;0,0;0,0;0,0;0
53480000;EDUCACAO PARA A PREVENCAO;0;0;0;0;0;0,0
59630000;FORM. IMPLEM. PROG. PROJ. PESSOA DEFICIENCIA;0;0;0;0;0;1797233,84
20790000;APOIO DESENV.INST.PREST.SERVICOS SAN.BASICO;0,0;120000,0;0;0;0;0
40720000;ESTIM. A MELHORIA PRATICA DE ESPORTE E LAZER;0;0;0;0;0;1081000,0
59950000;GESTAO DO FUNDO DE INTERESSES DIFUSOS;0;0;0;0;0;15433282,049999997
58490000;ESTUDOS NA AREA DE INOVACAO E COMPETITIVIDADE;690210,0;275397,98;215153,37;173325,0;332550,0;552000,0
42130000;APOIO AOS CONSELHOS;167758,14;111389,53000000001;625234,0800000001;32008,95;21059,299999999996;0
58680000;GESTAO DO CONHECIMENTO;0;0;0;0;0;0,0
22260000;EXPANSAO DA EDUCACAO PROFISSIONAL TECNICA;111709003,93000002;171088399,58;134932838,40999997;46797856,07;95101916,88;34335667,919999994
48320000;DISTRIBUICAO DE JUSTICA MILITAR;4096943,17;5688890,6;4362739,66;3716524,53;6157526,9;5558103,970000001
14620000;PRESERVACAO DA MATA ATLANTICA;0,0;0,0;0,0;0;0;0
60770000;RESTAURACAO ECOLOGICA;0;0;0;0;0;13777,3
20940000;LINHA 10 -LUZ-R. G.SERRA-MODERNIZACAO;54543456,579999976;61011289,830000006;34421136,879999995;31043325,26000001;10654970,66;0
22840000;RECUPERACAO DE ESTRADAS VICINAIS - BIRD II;0,0;35170396,63000001;17682381,14;0,0;96113,32;17526,62
12080000;REPASSE DE RECURSOS AO FUNAC;0;0;0;0,0;164000000,0;36000000,0
50320000;ADMINISTRAÇÃO E MANUTENÇÃO DA FUNDAÇÃO CERET;1929,22;0;0;0;0;0
50700000;INSPECAO FONTES POLUID.E DEGRAD.MEIO AMBIENTE;837479,4500000001;381204,7;299137,47;0;0;0
58400000;PESQUISA, DESENVOLVIMENTO E INOVACAO;0;0;0;0;0;12585152,39000001
54610000;PRODUÇÃO E TRANSMISSÃO DAS RÁDIOS AM/FM;0,0;284,2;0;0;0;0
51230000;ESPORTE, LAZER E INCLUSAO SOCIAL;0;0;0;0;0;89550,0
20740000;EXPANSAO DO ENSINO SUPERIOR E DA PESQUISA;18988608,37;15533468,049999999;9471204,7;0,0;0,0;0
53310000;CAPACITACAO PARA ATIVID. GERADORAS DE RENDA;43179,22;0,0;0,0;356248,92;954911,04;1942093,6
52960000;ATIVIDADES DIFUSAO CIENTIFICA E CULTURAL USP;0,0;0,0;0,0;0,0;0,0;0
50400000;ADMINISTRACAO DA SECRETARIA;0;0;0;0;0;5986599,37
50230000;ADMINISTRACAO GERAL;24939845,36999999;48270679,06000001;67488460,97999994;23425008,67;235158958,83;98548564,74
24760000;TRANSPORTE, LOGISTICA E MEIO AMBIENTE - CAF;0;0;0;0,0;27750922,19;51423,71
48500000;ATENDIMENTO AMBULATORIAL HOSPITALAR UNID.EST.;619668513,5100011;467134783,59999907;703885961,6900026;827380898,3199978;1045154870,41;0
50620000;LICENCIAMENTO E FISCALIZACAO AMBIENTAIS;0,0;0,0;0,0;0;0;0
44570000;VIGILANCIA SANITARIA VEGETAL;2062511,4500000002;4767629,609999999;1845327,5599999991;3006558,789999999;4471267,3100000005;0
49640000;GESTAO ADMINISTRATIVA E FINANCEIRA;0;0;0;0;0;2248727,7299999995
48270000;DESENV. IMPLEMENTACAO SISTEMAS DE INFORMACAO;199205,28000000003;0,0;35689800,94;58677564,06;92684120,37999998;0
48650000;EPIDEMIOLOGIA E INFORMACAO EM CANCER;312963,08;120298,0;401519,68000000005;414111,73000000004;516575,5500000001;439116,9299999999
22350000;COMPLEXO CULTURAL LUZ - TEATRO DA DANCA;7334044,27;16654629,399999999;13095846,02;1141702,34;135453,04;0
19890000;FINANCIAMENTO ACOES REC.COBRANCA USO DA AGUA;0,0;0,0;0,0;0,0;0;0
59090000;RECONHECIMENTO DE TERRITORIOS QUILOMBOLAS;0,0;2500,0;0,0;78085,0;0;0,0
51160000;CENTROS DE FORMACAO E DE EXCELENCIA ESPORTIVA;0;0;0;0;0;162561,81
59760000;SAO PAULO ESCOLA DE TEATRO;1926689,01;368910,61;399425,42;0,0;0,0;0
60440000;DESENVOLVIMENTO DE ENSINO E PESQUISA;0;0;0,0;134595,24;73406,15000000001;225073,63
24930000;COMPENSACAO AMB.-TRECHO NORTE ROD.MARIO COVAS;0;0;0;0;0,0;0
57840000;POLOS TURISTICOS, CULTURAIS E DE LAZER;71235,06000000001;306994,87999999995;2277999,15;304722,0;0,0;1069200,0
41490000;ATENDIMENTO MEDICO, AMBULATORIAL E HOSPITALAR;0,0;1929,0;0;0;0;0
20720000;BANCO DE DADOS ENSINO SUPERIOR EST.S.PAULO;0;0,0;2331,2;4867,08;0;0
55330000;ADMINISTRACAO  DO  PATRIMONIO  IMOBILIARIO;4832867,7700000005;1062619,98;51702314,12;36996091,79;2785149,65;0
53470000;CONHECENDO O PERIGO-PREVEN. AMEACAS MULTIPLAS;357448,81;27440,23;54880,46;0;0;0
61040000;EMPREENDEDOR PAULISTA;0;0;0,0;63368,76;0,0;0,0
42970000;ADMINISTRACAO AG.METROP.BAIXADA SANTISTA-AGEM;226502,03;154375,73000000007;229558,55000000005;0;0;0
59980000;CENTROS DE ESTUDOS DE LINGUAS - CEL'S;0;0,0;13561201,39;303621,7299999999;4821317,930000006;4943897,86
48680000;ATENDIMENTO MEDICO,AMBULATORIAL E HOSPITALAR;63695564,19000001;390702539,04;459490701,21000016;1660539,3299999998;8570,029999999999;1186,7
48910000;TRANSFERENCIA CONHECIMENTO PARA O AGRONEGOCIO;342704,98;306529,48;538077,6;271717,20999999996;316496,25;0
58770000;ADEQUACAO DESENV.PESSOAS E COMPETENCIAS;0,0;0,0;0;0;0;0
43020000;AVALIACAO E MAPEAMENTO DE AREAS DE RISCO;16223,99;87951,47;233692,31999999998;149286,65;246676,56;58504,970000000016
47830000;ACOES INTEGRADAS EM SEGURANCA ALIMENTAR;222311,69999999998;237550,83000000002;231287,80000000002;239577,47999999998;1244501,5399999998;0
55820000;IMPLANT. IMPLEM. POL. ATENCAO POVOS INDIGENAS;0,0;0,0;0;0;0;0
10400000;CONSTRUCAO E REFORMA DE EQUIP. ESPORTIVOS;12286515,809999999;6521360,22;4027986,7600000002;2910442,21;2142764,2399999998;5964456,899999999
50330000;TIMES DO EMPREGO;19553,0;18525,0;324730,0;156625,0;238906,12999999998;754743,75
21440000;FORTALECIMENTO SISTEMA ESTADUAL DE SANEAMENTO;0;0;0;0;0;0,0
57090000;CIRCULACAO CULTURAL;1807946,78;98205,6;95975,75;112281,96999999999;161314,86000000002;135121,11
23010000;PARQUE VARZEAS DO TIETE;0,0;1262877,7000000002;1054193,54;662421,53;3402705,3800000004;0
59040000;APOIO ADMINISTRATIVO;0;0;0;0;0;10028877,079999987
57970000;CAPACITACAO DEFENSORES SERVIDORES ESTAGIARIOS;0;0;0;0;0;468415,4600000001
61290000;PROMOCAO DA TRANSP.E INSTRUMENTOS DE DEF.US.;0;0;0;0,0;0;0
58480000;ASSISTENCIA E APOIO AO INVESTIDOR;15955087,0;23648560,15;6126112,15;909493,0;1122709,0;0,0
54260000;GERENCIAMENTO DO BENEFICIO-EDUCACAO;0;0;0;0;0;41945774,879999995
43880000;APOIO ADMINISTRATIVO;0;0;0;0;0;684231,39
60300000;EDUCACAO PARA O DESENVOLV. SOCIAL;0;0;0,0;705895,0;0,0;0
25050000;APOIO A PPP RODOVIA TAMOIOS-SERRA;0;0;0;0;0;0,0
54500000;PREMIO ESTIMULO A PRODUCAO CULTURAL;544000,0;588000,0;928000,0;896000,0;951500,0;0
48180000;DESENVOLVIMENTO DE RECURSOS HUMANOS;69829,0;24156,77;19990,0;54571,74;12205,0;24193,08
61570000;PRESERVACAO E CONSERVACAO DA CALHA DO TIETE;0;0;0;0;0;6454868,090000001
53620000;PRODUCAO DIVULG. INF.TEC.GEREN. ADM.PUBLICA;98639,06999999999;33550,44;15784,06;0;0;0
24850000;FINAN. ACOES UGRHI BAIXO TIETE - USO DA AGUA;0;0;0;0;0;0,0
61870000;DES. DE ACOES AREA AMBIENTAL FEHIDRO;0;0;0;0;0;0,0
42080000;MANUTENCAO DOS PALACIOS DO GOVERNO E ANEXOS;2245423,7700000005;3094726,02;4952524,360000003;679706,28;234857,99;0
57050000;FORMACAO E CAPACITACAO DE PROFISSIONAIS;0;0;0;0;0;1159479,58
43330000;CASA DE SOLIDARIEDADE;370176,0;295285,92;196294,0;0,0;329426,63;0,0
57190000;GESTAO DA FISCALIZACAO;0;0;0;0;0;5011057,2299999995
18550000;SUBSCRICAO DE ACOES DA EMPLASA;6394186,51;9423925,95;8337720,71;2841922,1999999997;569912,54;0,0
54160000;MONITORAMENTO DOS RECURSOS HIDRICOS;0;0;0,0;1075490,0;532792,05;0,0
60450000;EDUCACAO PARA O CONSUMO;0;0;0,0;25381,54;4518,8;828,4
21730000;LINHA 12-BRAS-CALMON VIANA-MODERN.EXP.OFERTA;55722204,86000001;36979503,87;33554328,700000003;13770319,550000004;14417231,779999996;0
58240000;INFORMACOES ESTRATEGICAS;0,0;0,0;0,0;0,0;0,0;0
23000000;SUBSCRICAO ACOES CIA. PAULISTA SECURITIZACAO;1800000,0;0,0;331000000,0;0;0;0
49930000;SEGURANCA TOTAL. PROTECAO INTEGRAL;160895146,19000056;355108731,6100004;356546925,8499992;383817093,1100011;653739840,1899968;0
24930000;COMPENSACAO AMBIENTAL RODOANEL MARIO COVAS;0;0;0;0;0;9480853,799999999
58680000;JORNADAS DE CAPACITACAO;78653,23999999999;0,0;0,0;0,0;0;0
57440000;PROVISAO MATERIAIS APOIO PEDAGOGICO-ENS.FUND.;81217181,13000003;116097588,68;44720548,339999996;21336417,03;24018871,69;88389,33
54860000;ATENDIMENTO E ORIENTACAO AOS CONSUMIDORES;1593806,3399999999;1321771,7799999998;1712054,56;900352,5299999999;2306376,15;0
56060000;APOIO TECNICO-PEDAGOGICO IMPLEMENT.PARCERIAS;6188,46;4521,0;5949,93;0;0;0
56040000;ACAO JOVEM;0;0;0;0;0;235045,14
50180000;RECUPERACAO AMBIENTES TRABALHO E ATENDIMENTO;8498667,09;10196108,67;12184228,829999998;5175538,1000000015;9889314,32;4566367,250000001
59360000;MONITORAMENTO DO DESENVOLVIMENTO METROPOLITAN;0;0;0,0;200000,0;620582,0;84084,0
18750000;IMPLANTACAO DA EXTENSAO DA LINHA C ATE GRAJAU;610060,7799999999;0,0;0;0;0;0
57760000;ANALISE LABORATORIAL DIAGNOSTICA;106534,23000000001;305383,44;36851,7;0;0;0
18400000;MODERNIZACAO SIST.INF.INT.SEC. E VINCULADAS;230800,0;0;0;0;0;0
16210000;SUBSCRICAO DE ACOES DA EMAE;0;0,0;0,0;0,0;6442,37;94463,35
57800000;VACINACAO DE ROTINA;1001337,0;864847,06;0,0;1651068,2;576523,2;2524070,4
44020000;BOLSAS DE ESTUDOS PESQUISA E DESENVOLVIMENTO;0,0;3600,0;0,0;0,0;0,0;19500,0
46730000;TRANSFERENCIAS FINANCEIRAS ENTIDADES DIVERSAS;0,0;0,0;0,0;0,0;0,0;0,0
55950000;SUPRIMENTO MEDIC. PRESOS CUST.POLICIA CIVIL;29926,42;846,0;0;0;0;0
23420000;CIRCUITO CULTURAL PAULISTA;0;0;0,0;0,0;0;0
22860000;MICROBACIAS II-ACESSO MERC. AGRIC.FAMILIARES;0,0;372045,72;2220343,08;2637878,9400000004;5589456,650000002;5939517,07
19630000;OBRAS ADEQ. AMPL. APARELHAMENTO  HCFMRP-USP;1921724,8900000001;317035,9;2751718,2700000005;0,0;0,0;0
49600000;FORTALECIMENTO AGRICULTURA FAMILIAR QUILOMBOS;0;0;0;0;0;10524497,360000001
50290000;PAGAMENTO DE SERVICOS GERAIS DO ESTADO;221185438,17;29155139,87;61705408,22;3083503,33;40826050,97;4466366,38
57430000;LER E ESCREVER;20923002,84;27739874,43;29138517,500000004;24723145,859999996;57743519,55;5028728,78
51310000;CAMPEONATOS E PRATICAS DESPORTIVAS;1118018,13;122875,51999999997;1738316,9500000004;3543555,04;2450368,1999999993;0
60000000;VIVA LEITE;0;0,0;0,0;11227058,349999998;13462346,589999996;1669565,8299999998
61100000;APOIO AO EGRESSO;0;0;0;0;0,0;193018,66
53060000;EXTENSAO UNIV.DIFUSAO CULT.SERV.COMUNIDADE;49825275,239999145;55247235,37999978;71582523,40000062;87187029,19999942;55590226,989999995;28027232,479999997
40090000;ADMINISTRACAO DA SECRETARIA DA HABITACAO;4356618,28;1960054,81;2850903,5099999993;2649584,1099999994;2318710,13;2381995,650000001
45380000;COMPLEMENTACAO APOSENTADORIAS  PENSOES -CDHU;74593,04;75102,12;83140,79999999999;87299,81;96633,0;103099,73
61680000;PROV.DE MATERIAL DIDATICO E APOIO PEDAGOGICO;0;0;0;0;0;23529720,519999996
23840000;CONSTRUCAO COMPLEXO CULT.LUZ-TEATRO DA DANCA;0;0;0,0;650202,03;2515434,11;0
20140000;TRILHAS DE SÃO PAULO - ECOTURISMO EM U.C.A.;70262,06;0;0;0;0;0
61260000;VIA RAPIDA EMPREGO;0;0;0,0;35488118,6;56164179,339999996;3376090,2300000004
56120000;PARCERIA EDUCACIONAL EST. MUNICIPIO-ENS.FUND.;0,0;0,0;0,0;0,0;138000,0;138000,0
58610000;SERV. ADMINISTRATIVOS SEC.REL.INSTITUCIONAIS;424412,08;398560,61;4889274,71;11680,0;0;0
20200000;AMPLIACAO DA AREA DE GUARDA DE ACERVO;4076303,06;19907712,27;3114988,02;110314,12;0;0
44620000;ENCARGOS JUDICIAIS;288306,6599999999;228200,57000000004;130539,41999999998;0;0;0
46270000;LINHAS FERROVIARIAS - OPERACAO DA CPTM;145493240,91999984;129247218,77999993;144183284,31000012;144977628,40000004;293047673,89000016;0
50220000;ADMINISTRACAO FINANCEIRA;17039080,67;12329831,670000004;13285753,430000003;13729798,300000006;17282777,3;23021424,920000006
53690000;MANUTENCAO DA REDE EXECUTIVA DO GOVERNO;0,0;0,0;0,0;0;0;0
49020000;OPERACAO PRACAS PEDAGIO RODOVIAS DER;0;0;0;0;0;633250,78
25160000;FINAN. ACOES UGRHI RIB. DE IGUAPE LITORAL SUL;0;0;0;0;0;0,0
56150000;PROMOCAO PROTECAO DIR.HUMANOS E DA CIDADANIA;18878,0;348467,88;13190,0;0;0;0
57520000;ADMINISTRACAO DA SAO PAULO PREVIDENCIA;4632997,560000001;8552648,099999998;7422499,33;14329588,060000004;14810891,29000001;10739357,200000001
52740000;ASSISTENCIA MEDICA, HOSPITALAR E AMBULATORIAL;0;0;0;0;0;107642060,98999994
54210000;ADMINISTRACAO DO IAMSPE;0;0;0;0;0;15896247,270000001
24770000;INVESTIMENTO RODOVIARIO ESTADO DE S.PAULO-BID;0;0;0;0;0;0,0
18150000;PROJETOS DO FUMEFI;35880222,55;40268224,46;52482191,260000005;48596385,019999996;51517869,51;71807789,64
15730000;IMPLANTACAO RESERVATORIOS RETENCAO- PISCINOES;5230737,53;1748442,25;5921057,199999999;28056958,26;53045646,65;0
23380000;MODERNIZACAO EXPANSAO COMPLEXO TURISTICO EFCJ;0;0;0;0;0;8905593,01
18620000;CONSTRUÇAO DO CAMPUS USP LESTE;0,0;0,0;0,0;0,0;0,0;0
24860000;PARTICIPACAO PROG.NAC.HABITACAO URBANA - FAR;0;0;0;0;0,0;0
24340000;QUALIFICACAO DO PATRIMONIO MUSEOLOGICO;0;0;0;0;0;950000,0
54180000;APOIO EDUC.BASICA REC.CONV. E TRANSFERENCIAS;4918316,779999998;962180,77;3221,64;0,0;5110,0;0
61690000;PROVISAO RECURSOS REALIZACAO ATIV.PEDAGOGICAS;0;0;0;0;0;1681498,0599999991
59620000;ADMINISTRACAO SEC.DIR.PESSOA COM DEFICIENICIA;0;0;0;0;0;1800129,3800000004
60830000;ESTRATEGIAS DESENV. SUSTENTAVEL MACROMETOPOLE;0;0;0,0;741600,0;721249,81;241901,92
24640000;MODERNIZACAO MT.RODANTE SISTEMA METROPOLITANO;0;0;0;0;0;47615552,230000004
44740000;ORGANIZACAO E ARTICULACAO REGIONAL;588351,0099999999;0,0;362663,8;634,09;826510,67;0,0
59230000;AVALIACAO CUSTOS ADM.POLITICAS GOVERNAMENTAIS;45514,75;76684,66;30245,04;0;0;0
58100000;ACAO COOP, ESTADO-MUNICIPIO CONSTR. ESCOLARES;23622889,090000007;32237972,959999997;55528944,33000001;130470924,2600002;141024626,12000024;0
59040000;GESTAO DA FUNDACAO CASA;2174985,389999999;2565676,570000002;2988590,6500000004;4446913,759999997;8669260,850000024;0
48910000;TRANSFERENCIA DE TECNOLOGIAS SUSTENTAVEIS;0;0;0;0;0;99992,65
52390000;FOMENTO APOIO AOS ARRANJOS PRODUTIVOS LOCAIS;1835379,97;212200,57;14099,54;208478,68;3921421,03;0
60530000;GESTAO DO PARQUE ESTADUAL ALBERTO LOFGREN;0;0;0,0;307861,6;392531,26;528,9399999999999
53230000;ATEND. PSICOSSOCIAL MATERIAL A POP.PRISIONAL;0;0;0,0;1839804,4299999997;0;0
50900000;COORD. ADM.GERAL DA SEC.TRANSP.METROPOLITANOS;10558593,44;7988786,579999999;9469774,159999998;8688370,93;8653245,11;0
10210000;IMPLANTACAO SISTEMA DRENAGEM COMBATE ENCHENTE;0;0;0;0;0;35332307,35999999
58840000;GESTAO DOS ORGAOS DE RECURSOS HUMANOS;960101,54;695037,06;1060445,44;1082689,6700000002;1874092,4;0
23640000;APERFEICOAMENTO DA INFRAESTRUTURA TECNOLOGICA;0;0;0,0;6712799,63;18429904,88;2904090,3099999996
20950000;LINHA 11-LUZ-ESTUDANTES-MODERN.EXP.EXPR.LESTE;71460955,42000003;73540143,20999998;64695738,46000001;54369812,18000002;27518416,20999999;0
52870000;PROGRAMACAO ESPECIAL;0,0;0,0;0,0;0,0;1597417,77;0,0
53350000;PREMIO MARIO COVAS;5177,0;0,0;0;0;0;0
